question_id,question_text,embedding_index
1,At any time during this school year did you attend a public or private school in person?,0
2,At any time during this school year did you receive any online schooling or virtual learning provided by a public or private school?,1
3,At any time during this school year did you receive homeschooling instead of being enrolled in a public or private school?,2
4,"At any time during this school year did you attend a homeschool cooperative, or co-op, in person?",3
5,Did you receive [online schooling or virtual learning/homeschooling instead of being enrolled in a public or private school/online schooling or virtual learning or homeschooling instead of being enrolled in a public or private school] because of the Coronavirus pandemic?,4
6,"For this next question, I’m going to read a list of 7 possible reasons that some families decided to homeschool rather than enroll in public or private school. You can say yes to more than one reason but please choose ones that best fit the reason or reasons your family decided to homeschool. Because of your experiences with bullying? Because of concerns about the school environment, such as safety, drugs, or negative peer pressure? Because you or your parents were not happy with the quality of the education you were receiving? Because of religious reasons? Because of a physical, mental, or developmental condition? Because of an illness that prevents you from attending school? Because of your county's decision to close the schools? Because of a different reason? What was the different reason?",5
7,How many different schools have you attended this school year?,6
8,"During the time you were homeschooled this school year, what grade would you have been enrolled in if you were in a public or private school?",7
9,What grade are you in?,8
10,In what month did your current school year begin?,9
11,Specify the other month that school year began,10
12,In what state is your school located?,11
13,In what county is your school located?,12
14,In what city is your school located?,13
15,What is the complete name of your school?,14
16,Is your school public or private?,15
17,Is this the regular school that most of the students in your neighborhood attend?,16
18,Is your school affiliated with a religion?,17
19,What is the lowest grade taught in your school?,18
20,What is the highest grade taught in your school?,19
21,"When you attend school in person, how do you get to school most of the time this school year?",20
22,"When you attend school in person, how do you get home from school most of the time this school year?",21
23,"During this school year, have you participated in any of the following activities sponsored by your school: Spirit groups, for example, Cheerleading, Dance Team, or Pep Club? Athletic teams at school? Performing arts, for example Band, Choir, Orhcestra, or Drama? Academic clubs, for example, Debate Team, honor Society, Spanish Club, Math Club, or Computer Club? Class council or Student government, also known as SGA? Volunteer or community service clubs sponsored by your school, for example, Peer Mediators, Environmental Club, or Recycling Club? Volunteer or community service clubs sponsored by your school, for example, Peer Mediators, Environmental Club, Key Club, or Interact? Do not include community service hours required for graduation. Other School clubs or schoool activities?",22
24,What are the other school clubs or school activities you participated in?,23
25,"Does your school have: Security guards or assigned police officers? Other adults supervisiing the hallway, such as teachers, administrators, or volunteers? Metal detectors, including wands? Locked entrance or exit doors during the day? A requirement that visitors sign in AND wear visitor badges or stickers? Locker checks? A requirement that students wear badges or picture identification? One or more security cameras to monitor the school?",24
26,"Does your school have a code of student conduct, that is, a set of written rules or guidelines that the school provides to you?",25
27,"If you hear about a threat to school or student safety, do you have a way to report it without having to give your name? Probe: Do you have a way to report a threat, such as an anonymous drop box or hotline?",26
28,"In your classes, how often are you distracted from doing your schoolwork because other students are misbehaving, for example, talking or fighting?",27
29,"Thinking about your school, would you strongly agree, agree, disagree, or strongly disagree with the following...? The school rules are fair. The punishment for breaking school rules is the same no matter who you are. The School rules are strictly enforced. If a school rule is broken, students know what kind of punishment will follow. Teachers treat students with respect.",28
30,"Thinking about the teachers and staff at your school, would you strongly agree, agree, disagree, or strongly disagree with the following…? There is a TEACHER or other ADULT at school who… Really cares about you. Listens to you when you have something to say. tells you when you do a good job. ",29
31,"Thinking about the students at your school, would you strongly agree, agree, disagree, or strongly disagree with the following…? There is a STUDENT at school who… Really cares about you. Believes that you will be a success.",30
32,"Thinking about the neighborhood where YOU LIVE, would you strongly agree, agree, disagree, or strongly disagree with the following…? There is a lot of crime in the neighborhood where YOU LIVE.",31
33,"Thinking about the neighborhood where YOUR SCHOOL is located, would you strongly agree, agree, disagree, or strongly disagree with the following...? There is a lot of crime in the neighborhood where YOU go to SCHOOL.",32
34,"Thinking about your school, would you strongly agree, agree, disagree, or strongly disagree with the following...? You feel safe in your school.",33
35,"During this school year, did you see another student who was under the influence of illegal drugs or alcohol while they were attending virtual school?",34
36,"Is it possible for students to get any of the following while at school… Alcoholic beverages? Marijuana, also known as pot or weed? Heroin or prescription painkillers illegally obtained without a prescription, such as Codeine, Percocet, or fentanyl? These are also known as opoids. Other prescription drugs illegally obtained without a prescription, such as Xanax, Ritalin, or Adderall? Other illegal drugs, such as cocaine, uppers, or crystal meth?",35
37,"During this school year, did you see another student who was under the influence of illegal drugs or alcohol while they were at school [IF E_ATTENDSCHOOL_VIRTUAL = “Yes” FILL: or during virtual classes]?",36
38,"During this school year, have you been in one or more physical fights at school?",37
39,"During this school year, how many times have you been in a physical fight at school?",38
40,"Now I have some questions about what students do during school that make you feel bad or are hurtful to you. These could occur in person or using technologies, such as a phone, the Internet, or social media. We often refer to this as being bullied. During this school year, has any student bullied you? That is, has another student... Made fun of you, called you names, or insulted you, in a hurtful way? Spread rumors about you or tried to make others dislike you? Purposely shared your private information, photos, or videos in a hurtful way? Threatened you with harm? Pushed you, shoved you, tripped you, or spit on you? Tried to make you do things you did want to do, for example, give them money or other things? Excluded you from activities, social media, or other communications to hurt you? Destroyed your property on purpose? ",39
41,"During this school year, how many days were you bullied?",40
42,"In that one day, how many times would you say other students did those things that made you feel bad or were hurtful to you?",41
43,Did you think the bullying would happen again?,42
44,"Thinking about the [time/times] you were bullied this school year, did more than one person do [this/these things] to you?",43
45,"Did these people act alone, together as a team, or both?",44
46,"Now I have some additional questions about the time [another student/other students] {behavior1}, {behavior2}, and {behaviorx…}. Thinking about the [person/people] who did [this/these things] to you this school year, [Was this person/Were any of these people/Was anyone in the group] physically bigger or stronger than you?",45
47,[Was this person/Were any of these people/Was anyone in the group] more popular than you?,46
48,[Did this person/Did any of these people/Did anyone in the group] have more money than you?,47
49,[Did this person/Did any of these people/Did anyone in the group] have the ability to influence what other students think of you?,48
50,[Did this person/Did any of these people/Did anyone in the group] have more power than you in another way?,49
51,In what other way [did that student/did any of those students] have more power than you?,50
52,What was your relationship to the student when they bullied you? Were they… Your brother or sister? Your boyfriend or girlfreind at the time? Your ex-boyfriend or ex-girlfreind at the time? Another student from school?,51
53,"Still thinking about the [time/times] that you were bullied, where did the bullying occur? Did it occur… Read answer categories, mark all that apply  1 = In a classroom at school?  2 = In a hallway or stairwell at school?  3 = In a bathroom or locker room at school?  4 = In a gymnasium or weight room at school?  5 = In a cafeteria or lunchroom at school?  6 = Outside on school grounds?  7 = On the way to or from school such as on a school bus or at a bus stop?  8 = Online or by text?  9 = Somewhere else? – Specify",52
54,Where is the other place where bullying occurred?,53
55,Did you tell a teacher or some other adult at school about being bullied?,54
56,"This school year, how much has bullying had a NEGATIVE effect on: Your school work? Your relationships with friends or family? How you feel about yourself? Your physical health for example, caused injuries, gave your headaches or stomach aches? ",55
57,"When you were bullied in school this year, did you ever think it was related to: Your race? Your religion? Your ethnic background or national origin- for example, people of Hispanic origin? Any condition you may have - such as a physical, mental, or developmental condition? Your gender? Your sexual orientation - such as gay, lesbian, bisexual, or straight? Your physical appearance?",56
58,"During this school year, has anyone called you an insulting or bad name at school having to do with your race, religion, ethnic background or national origin, disability, gender, or sexual orientation? We call these hate-related words.",57
59,"Were any of the hate-related words related to... Your race? Any disability you may have - such as physical, mental, or developmental disabilities? ",58
60,"During this school year, have you seen any hate-related words or symbols written in school classrooms, school bathrooms, school hallways, or on the outside of your school building?",59
61,"During this school year, have you seen any hate-related words, pictures, videos, or symbols posted on school sponsored websites or applications? This could include any website or application the school uses on a regular basis such as Google Classroom, Schoology, or Zoom.",60
62,"During this school year, did you ever skip any virtual classes because you were afraid other students would do things that make you feel bad or are hurtful to you?",61
63,"During this school year, did you ever STAY AWAY from any of the following places because you thought someone might attack or harm you there? For example, did you ever stay away from… The shortest route to school because you thought someone might attack or harm you? The entrance into the school? Any hallways or stairs in school? Parts of the school cafeteria or lunchroom? Any school restrooms? Other places inside the school building? School parking lot? Other places on school grounds? School bus or bus stop?",62
64,Did you AVOID any activities at your school because you thought someone might attack or harm you?,63
65,Did you AVOID any classes because you thought someone might attack or harm you?,64
66,"Did you stay home from school because you thought someone might attack or harm you in the school building, on school property, on a school bus, or going to or from school?",65
67,How often are you afraid that someone will attack or harm you in the school building or on school property?,66
68,How often are you afraid that someone will attack or harm you on a school bus or on the way to and from school?,67
69,"Besides the times you are in the school building, on school property, on a school bus, or going to or from school, how often are you afraid that someone will attack or harm you?",68
70,"Some people bring guns, knives, or objects that can be used as weapons to school for protection. During this school year, did you ever bring the following to school or onto school grounds? A gun? A knife brought as a weapon? Some other weapon? ",69
71,Do you know of any [other] students who have brought a gun to your school during this school year?,70
72,Have you actually seen another student with a gun at school during this school year?,71
73,"During this school year, could you have gotten a loaded gun without adult permission, either at school or away from school?",72
74,"Now, we'd like to know about gangs at your school. You may know these as street gangs, fighting gangs, or something else. Gangs may use common names, signs, symbols, or colors. Your answers will not be shared with anyone at your school or home. 42a. K_GANGS Are there any gangs at your school?",73
75,"During this school year, how often have gangs been involved in fights, attacks, or other violence at your school?",74
76,Have gangs been involved in the sale of drugs at your school during this school year?,75
77,"During this school year, across all subjects have you gotten mostly – Read answer categories 1 through 5. If student says the school uses pass/fail grading, ask which they’ve mostly gotten.",76
78,"During the last 4 weeks of school, did you skip any classes? Again, we would like to remind you that none of your responses will be shared with anyone at your school or home.",77
79,"During the last 4 weeks of school, on how many days did you skip at least one class?",78
80,"Thinking about the future, do you think you will... Attend school after high school, such as a college or technical school? Graduate from a 4-year college?",79
81,Was an adult member of the household or family present during at least part of these questions?,80
82,1. Have you ever had a checking or savings account in your name through a bank or financial institution?,81
83,2. Has anyone EVER used your checking or savings account to make a purchase or withdraw money without your permission?,82
84,"3. Has this happened during the past 12 months, that is from [AUTOFILL DATE 1st OF MONTH 1 YEAR PRIOR] until today?",83
85,4a. Did this most recently happen in 2021 or 2020? 4b And in what month?,84
86,"5. Have you ever had a credit card account in your name? Include major credit cards such as a MasterCard or Visa, and credit cards through retailers, such as Kohl’s, Walmart, or Amazon. Please do not include debit cards or gift cards.",85
87,"6. Has anyone EVER used one or more of your credit card accounts without your permission? ONLY include times when charges actually posted to your account, regardless of whether you were reimbursed later.",86
88,"7. Has this happened during the past 12 months, that is from [AUTOFILL DATE 1st OF MONTH 1 YEAR PRIOR] until today?",87
89,8a. Did this most recently happen in 2021 or 2020? 8b. And in what month?,88
90,"9a. Have you ever had at least one email account, such as Gmail or Outlook, or social media account such as Facebook or Instagram? 9b. Has anyone EVER used your email or social media account without your permission to pretend to be you?",89
91,"10a. Has this happened during the past 12 months, that is from [AUTOFILL DATE 1st OF MONTH 1 YEAR PRIOR] until today? 10b. Email account, such as Gmail or Outlook? 10c. Social media account, such as Facebook or Instagram? 10d. Please think about the most recent time someone misused [this/one of these] account(s). 10e. And in what month? __________ Month (01-12)",90
92,"11. Has anyone EVER used any of your other existing accounts, without your permission, such as…",91
93,"12. Has this happened during the past 12 months, that is from [AUTOFILL DATE 1st OF MONTH 1 YEAR PRIOR] until today?",92
94,"13. Which of the following types of your EXISTING accounts, other than credit card, bank, email, or social media accounts, did someone post charges to, take money from, or otherwise misuse? Did they misuse one or more of your… 13a. Telephone or internet accounts? 13b. Utilities accounts, such as cable, gas, or electric? 13c. Medical insurance accounts, such as Medicare or a health spending account? 13d. Entertainment accounts, such as for music, movies, or games? 13e. Online payment accounts, such as PayPal or Venmo? 13f. Some other type of account?",93
95,14a. Please think about the most recent time someone misused [this/one of these] existing account(s). Did this most recently happen in 2021 or 2020? 14b. And in what month?,94
96,"15. Has anyone EVER, without your permission, used your personal information to successfully open any NEW accounts, such as…",95
97,"16. Has this happened during the past 12 months, that is from [AUTOFILL DATE 1st OF MONTH 1 YEAR PRIOR] until today?",96
98,"17. With this next question, I’m going to read a list of 11 NEW accounts someone may have successfully opened using your personal information without your permission during the past 12 months. You can say yes to more than one account. 17a. New checking or savings accounts? 17b. New credit card accounts? 17c. New email accounts, such as Gmail or Outlook? 17d. New social media accounts, such as Facebook or Instagram? 17e. New telephone or internet accounts? 17f. New utilities accounts, such as cable, gas, or electric? 17g. New entertainment accounts, such as for music, movies, or games? 17h. New loans or mortgages? 17i. New insurance policies? 17j. New online payment accounts, such as PayPal or Venmo? 17k. Some other type of new account?",97
99,18a. Please think about the most recent time someone successfully opened [this/one of these] new account(s).,98
100,19. Has anyone EVER used your personal information for some other fraudulent purpose such as…,99
101,"20. Has this happened during the past 12 months, that is from [AUTOFILL DATE 1st OF MONTH 1 YEAR PRIOR] until today?",100
102,21. In which of the following ways has someone used your personal information during the past 12 months? Was your personal information used… 21a. To file a fraudulent tax return? 21b. To get medical treatment? 21c. To apply for a job? 21d. To provide false information to the police to conceal their identity? 21e. To provide false information to some other government authority such as the Department of Motor Vehicles? 21f. To apply for government benefits? 21g. In some other way not already mentioned?,101
103,22a. Please think about the most recent time your personal information was misused in [this way/one of these ways]. 22b. And in what month?,102
104,23. You said that in someone . Was this the result of one related incident or was your personal information misused multiple times in separate unrelated incidents? An incident of identity theft occurs when your information is stolen. A stolen credit card or debit card may be used multiple times but this should be considered a single incident.,103
105,24. You said that in someone . Were these the result of one related incident or was your personal information misused multiple times in separate unrelated incidents? An incident of identity theft occurs when your information is stolen. A stolen credit card or debit card may be used multiple times but this should be considered a single incident.,104
106,25. Which of these misuses of your personal information happened during the most recent incident?,105
107,26. How did you FIRST find out about the most recent incident of misuse of your personal information?,106
108,27. In what year and month did you first discover that someone had misused your personal information?,107
109,28. How long had your personal information been misused before you discovered it?,108
110,"29. Do you have any idea HOW your personal information was obtained, even if you are not completely certain?",109
111,30. How do you think your personal information was obtained?,110
112,"31. Were you in contact with anyone at a credit card company, bank, credit union, or other financial institution about misuse of your personal information?",111
113,32. Did you contact a credit bureau about the misuse of your personal information?,112
114,"33. At any credit bureau that you contacted, did you...",113
115,"34. After you told a credit bureau that your personal information had been misused, how satisfied were you with the credit bureau’s response? Were you very satisfied, somewhat satisfied, somewhat dissatisfied, or very dissatisfied?",114
116,"35. Did you contact any law enforcement agencies, such as the local police, a sheriff’s office or a federal law enforcement agency, to report misuse of your personal information?",115
117,36. Did the law enforcement agency take a police report from you about the misuse of your personal information?,116
118,37. Did you receive a copy of that police report? 37a. Did you send a copy of that police report to the credit bureau that you contacted?,117
119,"38. How satisfied were you with the law enforcement agency’s response when you reported the misuse of your personal information? Were you very satisfied, somewhat satisfied, somewhat dissatisfied, or very dissatisfied?",118
120,39. Why were you dissatisfied with the law enforcement agency’s response?,119
121,40. We would like to learn more about why people who experience identity theft do not report it to law enforcement. Why did you decide not to contact a law enforcement agency?,120
122,"41. Next, I'm going to read you a list of other people and organizations that someone might contact when their personal information is misused. Which of the following people or organizations, if any, did you contact about misuse of your personal information? Did you... a.Contact the business or organization associated with the misuse? b.Hire a lawyer? c. Contact a State or local government consumer affairs agency, such as the State Attorney General's office? d.Contact the Federal Trade Commission? e.Contact a nongovernment consumer agency, such as the Better Business Bureau or the National Consumer League? f. Contact a government agency that issues documents like driver's licenses or Social Security cards? g.Contact a nongovernment agency that issues documents, such as insurance cards? h.Contact a credit monitoring service or identity theft insurance company? i. Contact an office or agency – other than the police – that deals with victims of crime? j. Contact some other group or organization not already mentioned?",121
123,"42. The misuse of personal information affects people in different ways. Next, I would like to ask you some questions about how misuse of your personal information may have affected you. Did the misuse of your personal information lead you to have significant problems with your job or schoolwork or trouble with your boss, co-workers, or peers?",122
124,"43. Did the misuse of your personal information lead you to have significant problems with family members or friends, including getting into more arguments or fights than you did before, not feeling you could trust them as much, or not feeling as close to them as you did before?",123
125,"44. How distressing was the misuse of your personal information to you? Was it not at all distressing, mildly distressing, moderately distressing, or severely distressing?",124
126,45. Did you feel any of the following ways for A MONTH OR MORE because of misuse of your personal information? a. Worried or anxious? b. Angry? c. Sad or depressed? d. Vulnerable? e. Violated? f. Like you couldn’t trust people? g. Unsafe? h. Some other way?,125
127,46a. Did you seek any kind of professional help for the feelings you experienced as a result of misuse of your personal information?,126
128,47. Did you experience any of the following physical problems caused by misuse of your personal information for A MONTH OR MORE? Did you experience... a. Headaches? b. Trouble sleeping? c. Changes in your eating or drinking habits? d. Upset stomach? e. Fatigue? f. High blood pressure? g. Muscle tension or back pain? h. Some other problem?,127
129,48. Did you seek any kind of professional or medical help for the physical problems you just reported?,128
130,49. What kind of professional or medical help did you seek?,129
131,"50. Do you know, or have you learned, anything at all about the person or persons who misused your personal information?",130
132,"51. How well did you know this person or these people at the time of the incident? For example, was it a family member, friend, acquaintance, salesperson, or somebody else?",131
133,"52. What is the approximate total dollar value of what someone obtained when they misused your personal information ? Include the value of goods, services, credit, loans, cash, and anything else the person may have obtained.",132
