question_id,question_text,embedding_index
1380,"What was the MAIN reason you had this PSA test - was it part of a routine exam, because of a problem, or some other reason?",1379
1381,How many PSA tests have you had in the LAST 5 years?,1380
1382,Have you EVER HAD a test or tests to check for cervical cancer?,1381
1383,When did you have your MOST RECENT test to check for cervical cancer?,1382
1384,"What was the MAIN reason you had this cervical cancer test - was it part of a routine exam, because of a problem, or as a follow-up test of an earlier test or screening exam, or some other reason?",1383
1385,"At your MOST RECENT cervical cancer screening, did you have a Pap test?",1384
1386,"At your MOST RECENT cervical cancer screening, did you have an HPV test?",1385
1387,"At your MOST RECENT cervical cancer screening, did a doctor or other health professional tell you which type of test or tests you received?",1386
1388,"In the PAST 5 years, did any of your cervical cancer screening tests require follow-up to check for cancer or precancerous cells?",1387
1389,What is the MAIN REASON that you have ^never5yearsPAPHPV?,1388
1390,"A hysterectomy is when the uterus or womb is removed, this is different from having your tubes tied. Have you had a hysterectomy?",1389
1391,"Have you had BOTH ovaries removed, ^HYST as one or more separate surgeries?",1390
1392,Have you EVER HAD a mammogram?,1391
1393,About how long has it been since your MOST RECENT mammogram?,1392
1394,"What was the MAIN reason you had this mammogram - was it part of a routine exam, because of a problem, or some other reason?",1393
1395,"After your most recent mammogram, did you receive information about whether or not your breast tissue is dense?",1394
1396,Have you EVER HAD a breast exam done by a doctor or other health professional to check for lumps or other signs of breast cancer?,1395
1397,About how long has it been since your MOST RECENT breast exam?,1396
1398,"What was the MAIN REASON you had this breast exam -- was it part of a routine exam, because of a problem, or some other reason?",1397
1399,"In the past 12 months, have you experienced any of these symptoms associated with menopause?",1398
1400,Are you currently taking any PRESCRIPTION medication to treat symptoms associated with menopause?,1399
1401,Have you had at least one menstrual period in the past 12 months?,1400
1402,"Has your menstrual period stopped because you received medical treatment for irregular vaginal bleeding, such as an IUD, uterine ablation (uh-BLAY-shunn), birth control pills, or other hormone treatment?",1401
1403,"There are two types of flu vaccinations. One is a shot and the other is a spray, mist, or drop in the nose. During the past 12 months, have you had a flu vaccination?",1402
1404,During what month and year did you receive your most recent flu vaccine?,1403
1405,Enter year of most recent flu vaccine,1404
1406,"The next questions are about coronavirus or COVID-19 vaccination. During the past 12 months, have you had at least one dose of a COVID-19 vaccination?",1405
1407,During what month and year did you receive your MOST RECENT COVID-19 vaccination?,1406
1408,Enter year of most recent COVID-19 vaccination,1407
1409,A pneumonia shot is also known as a pneumococcal vaccine. Have you EVER had a pneumonia shot?,1408
1410,How many pneumonia shots have you ever had?,1409
1411,Have you had a vaccine for shingles?,1410
1412,A Tdap vaccination is a tetanus booster shot that also includes pertussis (per-TUH-sis) or whooping cough vaccine. Earlier you said that you had a pregnancy that ended in a live birth during the past 12 months. Did you receive a Tdap vaccine during this pregnancy?,1411
1413,Have you received a tetanus shot in the past 10 years?,1412
1414,There is a vaccine available since 2023 for some people that helps prevent the respiratory virus called RSV. Have you received the RSV vaccine?,1413
1415,"During the past 12 months, have you had an eye exam from an eye specialist such as an optometrist, ophthalmologist, or eye doctor?",1414
1416,"During the past 12 months, did you receive physical therapy, speech therapy, rehabilitative therapy, or occupational therapy?",1415
1417,"During the past 12 months, did you receive care at home from a nurse or other health professional?",1416
1418,"How often do you feel worried, nervous or anxious? Would you say daily, weekly, monthly, a few times a year, or never?",1417
1419,Do you take prescription medication for these feelings?,1418
1420,"Thinking about the last time you felt worried, nervous or anxious, how would you describe the level of these feelings? Would you say a little, a lot, or somewhere in between?",1419
1421,"How often do you feel depressed? Would you say daily, weekly, monthly, a few times a year, or never?",1420
1422,Do you take prescription medication for depression?,1421
1423,"Thinking about the last time you felt depressed, how depressed did you feel? Would you say a little, a lot, or somewhere in between?",1422
1424,"During the past 12 months, did you take prescription medication to help you with any other emotions or with your concentration, behavior or mental health?",1423
1425,"During the past 12 months, did you receive counseling or therapy from a mental health professional such as a psychiatrist, psychologist, psychiatric nurse, or clinical social worker?",1424
1426,Are you currently receiving counseling or therapy from a mental health professional?,1425
1427,"During the past 12 months, have you DELAYED getting counseling or therapy from a mental health professional because of the cost?",1426
1428,"During the past 12 months, was there any time when you needed counseling or therapy from a mental health professional, but DID NOT GET IT because of the cost?",1427
1429,"Over the last two weeks, how often have you been bothered by ...Little interest or pleasure in doing things? Would you say not at all, several days, more than half the days, or nearly every day?",1428
1430,"Over the last two weeks, how often have you been bothered by ...Feeling down, depressed, or hopeless? Would you say not at all, several days, more than half the days, or nearly every day?",1429
1431,"Over the last two weeks, how often have you been bothered by ...Trouble falling or staying asleep, or sleeping too much? * Read if necessary: Would you say not at all, several days, more than half the days, or nearly every day?",1430
1432,"Over the last two weeks, how often have you been bothered by ...Feeling tired or having little energy? * Read if necessary: Would you say not at all, several days, more than half the days, or nearly every day?",1431
1433,"Read if necessary: Over the last two weeks, how often have you been bothered by ...Poor appetite or overeating? * Read if necessary: Would you say not at all, several days, more than half the days, or nearly every day?",1432
1434,"Over the last two weeks, how often have you been bothered by ...Feeling bad about yourself, or that you are a failure, or have let yourself or your family down? * Read if necessary: Would you say not at all, several days, more than half the days, or nearly every day?",1433
1435,"Over the last two weeks, how often have you been bothered by ...Trouble concentrating on things, such as reading the newspaper or watching television? * Read if necessary: Would you say not at all, several days, more than half the days, or nearly every day?",1434
1436,"Over the last two weeks, how often have you been bothered by ...Moving or speaking so slowly that other people could have noticed? Or the opposite, being so fidgety or restless that you have been moving around a lot more than usual? * Read if necessary: Would you say not at all, several days, more than half the days, or nearly every day?",1435
1437,"Over the last two weeks, how often have you been bothered by the following problems ...Feeling nervous, anxious, or on edge? Would you say not at all, several days, more than half the days, or nearly every day?",1436
1438,"Over the last two weeks, how often have you been bothered by ...Not being able to stop or control worrying? * Read if necessary: Would you say, not at all, several days, more than half the days, or nearly every day?",1437
1439,"Over the last two weeks, how often have you been bothered by ...Worrying too much about different things? * Read if necessary: Would you say, not at all, several days, more than half the days, or nearly every day?",1438
1440,"Over the last two weeks, how often have you been bothered by ...Trouble relaxing? * Read if necessary: Would you say, not at all, several days, more than half the days, or nearly every day?",1439
1441,"Over the last two weeks, how often have you been bothered by ...Being so restless that it's hard to sit still? * Read if necessary: Would you say, not at all, several days, more than half the days, or nearly every day?",1440
1442,"Over the last two weeks, how often have you been bothered by ...Becoming easily annoyed or irritable? * Read if necessary: Would you say, not at all, several days, more than half the days, or nearly every day?",1441
1443,"Over the last two weeks, how often have you been bothered by ...Feeling afraid as if something awful might happen? * Read if necessary: Would you say, not at all, several days, more than half the days, or nearly every day?",1442
1444,"In the past three months, how often did you have pain? Would you say never, some days, most days, or every day?",1443
1445,"Thinking about the last time you had pain, how much pain did you have? Would you say a little, a lot, or somewhere in between?",1444
1446,"Over the past three months, how often did your pain limit your life or work activities? Would you say never, some days, most days, or every day?",1445
1447,"Over the past three months, how often did YOUR pain affect your family and significant others? Would you say never, some days, most days, or every day?",1446
1448,"Over the past three months, how much have you been bothered by ...Back pain? Would you say not at all, a little, a lot, or somewhere in between?",1447
1449,"Over the past three months, how much have you been bothered by ...Pain in your hands, arms, or shoulders? * Read if necessary: Would you say not at all, a little, a lot, or somewhere in between?",1448
1450,"Over the past three months, how much have you been bothered by ...Pain in your hips, knees, or feet? * Read if necessary: Would you say not at all, a little, a lot, or somewhere in between?",1449
1451,"Over the past three months, how much have you been bothered by ...Headache or migraine? * Read if necessary: Would you say not at all, a little, a lot, or somewhere in between?",1450
1452,"Over the past three months, how much have you been bothered by ...Abdominal, pelvic, or genital pain? * Read if necessary: Would you say not at all, a little, a lot, or somewhere in between?",1451
1453,"Over the past three months, how much have you been bothered by ...Toothache or jaw pain? * Read if necessary: Would you say not at all, a little, a lot, or somewhere in between?",1452
1454,"Over the past three months, did you use any of the following to manage your pain? ...Over-the-counter medications such as aspirin, Tylenol, Advil, or Aleve?",1453
1455,"Over the past three months, did you use any of the following to manage your pain? ...An opioid pain reliever prescribed by a doctor, dentist, or other health professional? Examples include codeine, hydrocodone, morphine, oxycodone, OxyContin, Percocet, and Percodan. If you are not sure, please tell me the name of the drug and I can look it up.",1454
1456,"Over the past three months, did you use any of the following to manage your pain? ...A pain reliever other than an opioid prescribed by a doctor, dentist, or other health professional?",1455
1457,"Over the past three months, did you use any of the following to manage your pain? ...Physical therapy, rehabilitative therapy, or occupational therapy?",1456
1458,"Over the past three months, did you use any of the following to manage your pain? ...Spinal manipulation or other forms of chiropractic care?",1457
1459,"Over the past three months, did you use any of the following to manage your pain? ...Talk therapies such as cognitive-behavioral therapy (CBT)?",1458
1460,"Over the past three months, did you use any of the following to manage your pain? ...Yoga, Tai Chi, or Qi Gong (chee-GONG)?",1459
1461,"Over the past three months, did you use any of the following to manage your pain? ...Other forms of exercise, such as walking, swimming, bike riding, stretching, or strength training?",1460
1462,"Over the past three months, did you use any of the following to manage your pain? ...Massage?",1461
1463,"Over the past three months, did you use any of the following to manage your pain? ...Meditation, guided imagery, or other relaxation techniques?",1462
1464,"Over the past three months, did you use any other approaches to manage your pain?",1463
1465,"During the past 12 months, as a result of a blow or jolt to the head, have you been knocked out or lost consciousness, been dazed or confused, or had a gap in your memory?",1464
1466,"During the past 12 months, as a result of a blow or jolt to the head, have you had headaches, sensitivity to light or noise, balance problems, or changes in mood or behavior?",1465
1467,"^CDCMG_A Were you playing a sport or participating in a physical or recreational activity, such as jogging, biking, or pick-up games, when you experienced any of these blows or jolts to the head?",1466
1468,Were you participating in an organized team or league sports competition or practice when you experienced any of these blows or jolts to the head?,1467
1469,"During the past 12 months, as a result of a blow or jolt to the head, were you evaluated for a concussion or brain injury by a doctor, nurse, paramedic, athletic trainer, or other health professional?",1468
1470,Have you smoked at least 100 cigarettes in your ENTIRE LIFE?,1469
1471,"Do you NOW smoke cigarettes every day, some days or not at all?",1470
1472,"On average, about how many cigarettes do you NOW smoke a day?",1471
1473,On how many of the past 30 days did you smoke a cigarette?,1472
1474,"On average, when you smoked during the past 30 days, about how many cigarettes did you smoke a day?",1473
1475,"Have you ever used an e-cigarette or other electronic vaping product, even just one time, in your entire life?",1474
1476,"Do you NOW use e-cigarettes or other electronic vaping products every day, some days, or not at all?",1475
1477,"Have you ever smoked a regular cigar, cigarillo, or a little filtered cigar EVEN ONE TIME?",1476
1478,"Do you NOW smoke regular cigars, cigarillos, or little filtered cigars every day, some days, or not at all?",1477
1479,"On how many of the past 30 days have you smoked a regular cigar, cigarillo, or little filtered cigar?",1478
1480,"Smokeless tobacco products are placed in the mouth or nose and can include chewing tobacco, snuff, dip, snus (SNOOSE), nicotine pouches, or dissolvable tobacco. Have you ever used smokeless tobacco products EVEN ONE TIME?",1479
1481,"Do you NOW use smokeless tobacco products every day, some days, or not at all?",1480
1482,"How often do you get the social and emotional support you need? Would you say always, usually, sometimes, rarely, or never?",1481
1483,"How often do you feel lonely? Would you say always, usually, sometimes, rarely, or never?",1482
1484,"In a typical week, and not including people you live with, how many times do you get together with people that you care about and feel close to?",1483
1485,"In a typical week, and not including people you live with, how many times do you talk on the telephone or by video with people that you care about and feel close to?",1484
1486,"During the past 12 months, how many times did you attend religious services?",1485
1487,"During the past 12 months, how many times did you attend meetings of clubs or organizations you belong to?",1486
1488,"How often do you get the social and emotional support you need with parenting and raising children? Would you say always, usually, sometimes, rarely, or never?",1487
1489,"How often do you find it difficult handling the day-to-day demands of parenting and raising children? Would you say every day, most days, some days, rarely, or never?",1488
1490,"How often do you talk, chat, or connect with other parents about your children or their children? Would you say every day, most days, some days, rarely, or never?",1489
1491,"During the past 12 months, did you have problems or difficulty with your VOICE, such as having a hoarse, raspy, tired, or strained voice, or trouble speaking loud enough to be heard?",1490
1492,"During the past 12 months, about how many days, weeks, or months did you have problems or difficulty with your voice?",1491
1493,"During the past 12 months, how much difficulty did you have with your voice? Would you say a little, a lot, or somewhere in between?",1492
1494,"During the past 12 months, did you have problems or difficulty with SWALLOWING, such as having difficulty eating solid food, taking pills, or drinking liquids?",1493
1495,"During the past 12 months, about how many days, weeks, or months did you have problems or difficulty with swallowing?",1494
1496,"During the past 12 months, how much difficulty did you have with swallowing? Would you say a little, a lot, or somewhere in between?",1495
1497,"During the past 12 months, did you have problems or difficulty with your SPEECH, such as stuttering, repeating words, or not being able to pronounce words correctly?",1496
1498,"During the past 12 months, about how many days, weeks, or months did you have problems or difficulty with your speech?",1497
1499,"During the past 12 months, how much difficulty did you have with your speech? Would you say a little, a lot, or somewhere in between?",1498
1500,"During the past 12 months, did your speech problems or difficulty include stuttering, trouble pronouncing words correctly, or both?",1499
1501,"During the past 12 months, did you have problems or difficulty with LANGUAGE, such as difficulty using, learning, or understanding words, sentences, or conversational interactions?",1500
1502,"During the past 12 months, about how many days, weeks, or months did you have problems or difficulty with language?",1501
1503,"During the past 12 months, how much difficulty did you have with language? Would you say a little, a lot, or somewhere in between?",1502
1504,Did any of your ^VSLTYPE_A problems or difficulty follow a head or brain injury or stroke?,1503
1505,"During the past 12 months, did you see a speech-language pathologist, doctor, or other health care professional for evaluation, treatment, or rehabilitation services of your ^VSLTYPE_A problems or difficulty?",1504
1506,"How did those evaluation, treatment, or rehabilitation services affect your life as a whole? Has your life improved greatly, improved somewhat, stayed the same, or gotten worse?",1505
1507,"During the past 12 months, did your problems or difficulty with ^VSLTYPE_A get a lot better, get a little better, stay the same, get a little worse, or get a lot worse?",1506
1508,"Do you think of yourself as ^gaylesbian; straight, that is, not ^gaylesbian; bisexual; something else; or you don't know the answer?",1507
1509,Could you tell me what you mean by ^ORIENTSP?,1508
1510,"The next questions are about marriage and cohabitation. Are you now married, living with a partner together as an unmarried couple, or neither?",1509
1511,Does your spouse live here?,1510
1512,Which person is your spouse?,1511
1513,I previously recorded ^SPOUSENAME's ^spousesex. Is this correct?,1512
1514,Is ^SPOUSENAME male or female?,1513
1515,Does your spouse not live here because you and your spouse are legally separated?,1514
1516,Which person is your partner?,1515
1517,I previously recorded ^PARTNERNAME's ^partnersex. Is this correct?,1516
1518,Is ^PARTNERNAME male or female?,1517
1519,Have you ever been married?,1518
1520,"What is your current legal marital status? Are you married, widowed, divorced, or separated?",1519
1521,"Are you widowed, divorced, or separated?",1520
1522,"Did you ever serve on active duty in the U.S. Armed Forces, military Reserves, or National Guard?",1521
1523,Were you on active duty ONLY for training in the Reserves or National Guard?,1522
1524,Did you ever serve in a foreign country during a time of armed conflict or on a humanitarian or peace-keeping mission?,1523
1525,Do you have a VA service-connected disability rating?,1524
1526,"During the past 12 months, did you receive any care at a Veteran's Health Administration facility or receive any other health care paid for by the VA?",1525
1527,Have you ever enrolled in or used VA health care?,1526
1528,Askverify_A Were you born in the United States or a U.S. territory?,1527
1529,In what state or U.S. territory were you born?,1528
1530,In what year did you come to the United States to stay,1529
1531,Are you a citizen of the United States?,1530
1532,"Were you born abroad to an American parent, born abroad and adopted by an American parent, or did you become a U.S. citizen by naturalization?",1531
1533,Do you speak a language other than English at home?,1532
1534,What other language do you speak most often at home?,1533
1535,Enter language spoken most often at home.,1534
1536,"When you watch television, read news online or in print, or listen to the radio, which language do you use most often?",1535
1537,"When you see a doctor or other health care professional, which language do you use most often?",1536
1538,"When you participate in social activities, such as visiting friends, attending clubs and meetings, or going to parties, which language do you use most often?",1537
1539,Are you currently enrolled in or attending school?,1538
1540,"During the past 12 months, about how many days of school did you miss because you had an illness, injury, or disability?",1539
1541,"LAST WEEK, did you work for pay at a job or business?",1540
1542,"Did you have a job or business LAST WEEK, but were temporarily absent due to illness, vacation, family or maternity leave, or some other reason?",1541
1543,What is the MAIN reason you were not working for pay at a job or business last week?,1542
1544,"When was the last time you worked for pay at a job or business, even if only for a few days?",1543
1545,^Whenwork many hours do you USUALLY work in total at ALL jobs or businesses?,1544
1546,^WhenworkDo you USUALLY work 35 hours or more per week in total at ALL jobs or businesses?,1545
1547,^LASTJOB paid sick leave available if you ^workneed it?,1546
1548,^LASTJOB health insurance offered to you through your workplace?,1547
1549,"During the past 12 months, about how many days of work did you miss because you had an illness, injury, or disability?",1548
1550,"During the past 30 days, did you provide regular care or assistance to a friend or family member who has a health problem or disability?",1549
1551,"During the past 12 months, did you spend any time volunteering for any organization or association?",1550
1552,"Some people don't think of activities they do infrequently or for children's schools or youth organizations as volunteer activities. During the past 12 months, have you done any of these types of activities?",1551
1553,Does ^ALIASNAME work for pay at a job or business?,1552
1554,Does ^ALIASNAME usually work 35 hours or more per week in total at ^hishertheir job or jobs?,1553
1555,"In ^LASTYEAR, did ^YOUFAM18YRS receive income from wages, salaries, commissions, bonuses, tips, or self-employment?",1554
1556,"In ^LASTYEAR, did ^YOUFAMHERE receive income from interest-bearing accounts or investments, dividends from stocks or mutual funds, net rental income, royalty income, or income from estates and trusts?",1555
1557,"In ^LASTYEAR, did ^YOUFAMHERE receive... Income from Social Security or Railroad Retirement?",1556
1558,"Supplemental Security Income, SSI, or Social Security Disability Income, SSDI, which are different from Social Security?",1557
1559,"Was this Supplemental Security Income, SSI, Social Security Disability Income, SSDI, or both? Was this received as a disability benefit? In ^LASTYEAR, who received this disability benefit?",1558
1560,"In ^LASTYEAR, did ^YOUFAMHERE receive... Any public assistance or welfare payments from the state or local welfare office?",1559
1561,"In ^LASTYEAR, did ^YOUFAMHERE receive... Income from retirement, survivor, or disability pensions?",1560
1562,"In ^LASTYEAR, did ^YOUFAMHERE receive... Any other sources of income such as VA payments from the Veterans Benefits Administration, unemployment compensation, child support, or alimony?",1561
1563,"What is your best estimate of ^TOTALINCOME from all sources, before taxes, in ^LASTYEAR?",1562
1564,Was your total ^FAMILY income from all sources less than ^250POVERTY_A or ^250POVERTY_A or more?,1563
1565,Was your total ^FAMILY income from all sources less than ^138POVERTY_A or ^138POVERTY_A or more?,1564
1566,Was your total ^FAMILY income from all sources less than ^100POVERTY_A or ^100POVERTY_A or more?,1565
1567,Was your total ^FAMILY income from all sources less than ^200POVERTY_A or ^200POVERTY_A or more?,1566
1568,"Was your total ^FAMILY income from all sources less than $75,000 or $75,000 or more?",1567
1569,"Was your total ^FAMILY income from all sources less than $100,000 or $100,000 or more?",1568
1570,Was your total ^FAMILY income from all sources less than ^400POVERTY_A or ^400POVERTY_A or more?,1569
1571,"Was your total ^FAMILY income from all sources less than $150,000 or $150,000 or more?",1570
1572,At any time in the last 12 months did ^YOUFAMLVHERE_A receive ^FSSNAPNM?,1571
1573,"At any time in the last 12 months did ^YOUFAMLVHERE_A receive benefits from the WIC program, that is, the Women, Infants, and Children program?",1572
