question_id,question_text,embedding_index
4680,What was the main reason ( you/he/she) (was/were) absent from work (THE WEEK BEFORE LAST/LAST WEEK)?,4679
4681,What is the main reason (name/you) worked less than 35 hours (THE WEEK BEFORE LAST/LAST WEEK)?,4680
4682,"(THE WEEK BEFORE LAST/LAST WEEK), could (name/you) have worked full time IF the hours had been available?",4681
4683,Has (name's/your) employer given (you/he/she) a date to return to work?,4682
4684,(Have / Has) (you/he/she) been given any indication that ( you/he/she) will be recalled to work within the next 6 months?,4683
4685,Could (you/he/she) have returned to work (THE WEEK BEFORE LAST/LAST WEEK) IF (you/he/she) had been recalled? Why is that?,4684
4686,"Even though (you/he/she) (expect/expects) to be called back to work, (have/has) (you/he/she) been looking for work during the last 4 weeks?",4685
4687,"As of the end of (THE WEEK BEFORE LAST/LAST WEEK), how long had/has (you/he/she) been on layoff?",4686
4688,"We would like to have that in weeks, IF possible, exactly how many weeks had (name/you) been on layoff?",4687
4689,Is the job from which (name/you) (are / is) on layoff a full time job of 35 hours or more per week?,4688
4690,(Have / Has) (name/you) been doing anything to find work during the last 4 weeks?,4689
4691,What are all the things (you/he/she) (have/has) done to find work during the last 4 weeks?,4690
4692,You said (name/you) (have/has) been trying to find work. How did ( you/he/she) go about looking?,4691
4693,Can you tell me more about what (he/she) did to search for work?,4692
4694,"(THE WEEK BEFORE LAST/LAST WEEK), could (you/he/she) have started a job if one had been offered?",4693
4695,Why is that?,4694
4696,"BEFORE (name/you) started looking for work, what (was/were) (you/he/she) doing: working, going to school, or something else?",4695
4697,"Did (you/he/she) lose or quit that job, or was it a temporary job that ended?",4696
4698,When did (you/he/she) last work at (a/that) job or business?,4697
4699,Earlier you told me (you/name) had a currently active professional certification or license. Is (your/his/her) certification or license required for (your/his/her) … a) job b) main job? c) job from which (you/he/she/) (are/is) on layoff? d) job at which (you/he/she) last worked?,4698
4700,What was the month and year that (you/he/she) last worked?,4699
4701,"As of the end of (THE WEEK BEFORE LAST/LAST WEEK), how long had (you/he/she) been looking for work?",4700
4702,We would like to have that in weeks if possible. Exactly how many weeks (have/has) (name/you) been looking for work?,4701
4703,(Have / Has) (you/he/she) been looking for full time work of 35 hours or more per week?,4702
4704,What is the main reason (you/he/she) (was/were) not looking for work during the LAST 4 WEEKS?,4703
4705,Did (name/you) look for work at any time during the last 12 months?,4704
4706,Did (you/he/she) actually WORK at a job or business during the last 12 months?,4705
4707,Did (you/he/she) do any of this work during the last 4 weeks?,4706
4708,And since (name/you) LEFT that job or business (have/has) (you/he/she) looked for work?,4707
4709,"(THE WEEK BEFORE LAST/LAST WEEK), could (you/he/she) have started a job IF one had been offered?",4708
4710,(Have / Has) (name/you) worked at a job or business at any time during the past 12 months?,4709
4711,What is the main reason (you/he/she) left (your/his/her) last job?,4710
4712,(Do / Does) (name/you) intend to look for work during the next 12 months?,4711
4713,"Last month, it was reported that (name/you) worked for (input.IO1NAM). (Do / Does) (you/he/she) still work for (input.IO1NAM)",4712
4714,Have the usual activities and duties of (your/his/her) job changed since last month?,4713
4715,Last month (name/you) (was/were) reported as (a/an) (input.IO1OCC) and (your/his/her) usual activities were (input.IO1DT1 8500.IO1DT2). Is this an accurate description of (your/his/her) current job?,4714
4716,"(Were/Was) (name/you) employed by government, by a private company, a nonprofit organization, or (was/were) ( you/he/she) self -(or working in the family business?)? Would that be the federal, state, or local government?",4715
4717,(Is/Was) this business incorporated?,4716
4718,(Do/Does) (name/you) usually have any paid employees?,4717
4719,"Excluding all owners, how many paid employees does (name's/your) business usually have?",4718
4720,(Were/Was) (name/you) working for pay?,4719
4721,What is the name of the (company/non-profit organization) for which (you/he/she) work (at main job)/worked (at main job)/works (at main job) (work/works/worked),4720
4722,What is the name of the government agency for which (you/he/she) (work/works),4721
4723,What is the name of (your/name's) business?,4722
4724,"Is this business or organization mainly manufacturing, retail trade, wholesale trade, or something ELSE",4723
4725,"What kind of work (DO/DOES/DID) (name/you) do, that is, what (is/was) (your/his/her) occupation? F",4724
4726,What (are / were) (your/his/her) usual activities or duties at this job?,4725
4727,"Is this business or organization mainly manufacturing, retail trade, wholesale trade, or something ELSE?",4726
4728,"What kind of work (DO/DOES/DID) (name/you) do, that is, what (is/was) (your/his/her) occupation",4727
4729,"(THE WEEK BEFORE LAST/LAST WEEK) at (name's/your) second job,(was/were) (name/you) employed by government, by a private company, a non-profit organization, or (was/were) (you/he/she) self (or working in the family business?) Would that be the federal, state, or local government",4728
4730,(Do / Does) (name/you) usually have any paid employees?,4729
4731,(Was/Were) (name/you) working for pay?,4730
4732,What is the name of the (company/non-profit organization) for which (name/you) work (at main job)/worked (at main job)/works (at main job) at (your/his/her) SECOND job?,4731
4733,What is the name of the government agency for which (name/you) (work/works) at (your/his/her) SECOND job?,4732
4734,"What kind of work (DO/DOES/DID) (name/you) do, that is, what (is/was) (your/his/her) occupation?",4733
4735,What are (your/his/her) usual activities or duties at this job?,4734
4736,"For (name's/your) (job/MAIN job), what is the easiest way for you to report (your/his/her) total earnings BEFORE taxes or other deductions: hourly, weekly, annually, or on some other basis?",4735
4737,"(Do / Does) (name/you) usually receive overtime pay, tips, or (commissions?/commissions at (your/his/her) MAIN job?)",4736
4738,"(EXCLUDING overtime pay, tips and commissions) what is (your/his/her) hourly rate of pay on (this job/ (your/his/her) MAIN job)?",4737
4739,What is your best estimate of (your/his/her) hourly rate of pay?,4738
4740,How many hours (do/does) (name/you) usually work per week at this rate?,4739
4741,"(How/At (your/his/her) MAIN job, how) much (do/does) (you/he/she) usually receive JUST in overtime pay, tips or commissions, before taxes or other deductions?",4740
4742,"What is your best estimate of how much (you/he/she) usually (earn/earns) WEEKLY, JUST in overtime pay, tips, or commissions, before taxes or other deductions?",4741
4743,"Do not ask: Usual (weekly/hourly/monthly/annual) earnings in overtime pay, tips or commissions recorded as: (ERNOTO) Is this entry correct?",4742
4744,What is your best estimate of the number of hours per week (you/he/she) usually (work/works) at this rate?,4743
4745,I have estimated (your/his/her) usual WEEKLY earnings (as/for (your/his/her) main job as) (AMOUNT) before taxes or other deductions. Does that sound correct?,4744
4746,Which piece or pieces of information do not seem to be correct?,4745
4747,"What is (name's/your) hourly rate of pay on this job, excluding overtime pay, tips or commissions?",4746
4748,How many hours (do/does) (name/you) usually work per week at the rate of (entry in ERNH1C/ERNH1O)?,4747
4749,"How much (do/does) (name/you) usually earn (weekly/monthly/annually) just in overtime pay, tips or commissions?",4748
4750,"How much (do/does) (name/you) usually earn hourly just in overtime pay, tips or commissions?",4749
4751,How many hours (do/does) (name/you) usually work per week at the rate of (entry in ERNOHC/ERNOTO)?,4750
4752,"Then, including overtime pay, tips and commissions, what are (name/you) usual WEEKLY earnings on (this job/ (your/his/her) MAIN), before taxes or other deductions?",4751
4753,"I have estimated (your/his/her) total WEEKLY earnings (as/ for (your/his/her) main job, as (entry in ERNX2) WEEKLY before taxes or other deductions. Does that sound correct?",4752
4754,"(Including overtime pay, tips and commissions,) What are (name's/your) usual weekly earnings on (this job/ (your/his/her) MAIN), before taxes or other deductions?",4753
4755,"(Including overtime pay, tips and commissions,) what are (name's/your) usual twice monthly earnings on (this job/ (your/his/her) MAIN), before taxes or other deductions?",4754
4756,"(Including overtime pay, tips and commissions,) what are (name's/your) usual monthly earnings on (this job/ (your/his/her) MAIN), before taxes or other deductions?",4755
4757,"(Including overtime pay, tips and commissions,) what are (name's/your) usual annual earnings on (this job/ (your/his/her) MAIN), before taxes or other deductions?",4756
4758,"(Including overtime pay, tips and commissions,) what are (name's/your) usual bi weekly earnings on (this job/ (your/his/her) MAIN), before taxes or other deductions?",4757
4759,What is your best estimate of (your/his/her) usual (weekly/bi-weekly/monthly/annual) earnings before taxes or other deductions?,4758
4760,I have recorded (your/his/her) total earnings (for (your/his/her) (as/main job ) (ERNAMT) (weekly/bi-weekly/monthly/annually) before taxes or other deductions. Is that correct?,4759
4761,"(Including overtime pay, tips and commissions,), what are (your/his/her) usual (weekly/bi-weekly/monthly/annual) earnings on (this job/ (your/his/her) MAIN), before taxes or other deductions?",4760
4762,How many weeks a year (do/does) (name/you) get paid for?,4761
4763,(Even though you told me it is easier to report (your/his/her) earnings (you/he/she) PAID AT AN HOURLY RATE on (this job/ (your/his/her) MAIN)?,4762
4764,"(EXCLUDING overtime pay, tips and commissions) what is (your/his/her) hourly rate of pay on (this job/ (your/his/her) MAIN) job?",4763
4765,"On this job, (are / is) (name/you) a member of a labor union or of an employee association similar to a union?",4764
4766,"On this job, (are / is) (name/you) covered by a union or employee association contract?",4765
4767,When did (name/you) last work at a job or business?,4766
4768,(Are / Is) (name/you) retired FROM A JOB OR BUSINESS?,4767
4769,"What best describes (name's/your) situation at this time? For example, (are / is) (you/he/she) disabled, ill, in school, taking care of house or family, or something ELSE?",4768
4770,"(THE WEEK BEFORE LAST/LAST WEEK), (was/were) (you/he/she) enrolled in a high school, college, or university?",4769
4771,"Would that be high school, college or university?",4770
4772,(Are / Is) (you/he/she) enrolled in school as a full time or part time student?,4771
4773,"(We will recontact this household in 8 months / In the future we may need to recontact this household / We will recontact this household next month) to update this information. If we are unable to reach you and we talk to someone else instead, is it OK if we refer to some of the information you gave us?",4772
4774,(Are you/Is NAME/Is anyone/Are any of the new household members) deaf or (do you/does NAME/does anyone/do they) have serious difficulty hearing?,4773
4775,"(Are you/Is NAME/Is anyone/Are any of the new household members) blind or (do you/does NAME/does anyone/do they) have serious difficulty seeing, even when wearing glasses?",4774
4776,"Because of a physical, mental, or emotional condition, (do you/does NAME/does anyone/do any of the new household members) have serious difficulty concentrating, remembering, or making decisions?",4775
4777,(Do you/Does NAME/Does anyone/Do any of the new household members) have serious difficulty walking or climbing stairs?,4776
4778,(Do you/Does NAME/Does anyone/Do any of the new household members) have difficulty dressing or bathing?,4777
4779,"Because of a physical, mental, or emotional condition, (do you/does NAME/does anyone/do any of the new household members) have difficulty doing errands alone such as visiting a doctor's office or shopping?",4778
4780,In what country (was/were) (name/you) born?,4779
4781,In what country was (your/his/her) mother born?,4780
4782,In what country was (your/his/her) father born?,4781
4783,(Are / Is) (name/you) a CITIZEN of the United States?,4782
4784,(were/was) (name/you) born a citizen of the United States?,4783
4785,Did (name/you) become a citizen of the United States through naturalization?,4784
4786,When did (name/you) come to live in the United States?,4785
4787,Which category represents (your/name of reference person/the total combined income) (total combined income during the past 12 months?/ of all members of your FAMILY during the past 12 months?/ of all members of (name of reference person) 's FAMILY during the past 12 months?),4786
4788,"During the 2019–20 school year, was it a practice of your school to do the following? • If your school changed its practices during the school year, please answer regarding your most recent practice.  a. Require visitors to sign or check in and wear badges b. Control access to school buildings during school hours (e.g., locked or monitored doors, loading docks) c. Control access to school grounds during school hours (e.g., locked or monitored gates) d. Equip classrooms with locks so that doors can be locked from the inside e. Close the campus for most or all students during lunch f. Provide school lockers to students g. Have “panic button(s)” or silent alarm(s) that directly connect to law enforcement in the event of an incident h. Provide an electronic notification system that automatically notifies parents in case of a school-wide emergency i. Require faculty and staff to wear badges or picture IDs j. Use one or more security cameras to monitor the school k. Provide two-way radios to any staff l. Require metal detector checks on students every day m. Perform one or more random metal detector checks on students n. Perform one or more random sweeps (e.g., locker checks, dog sniffs) for contraband (e.g., drugs or weapons*) o. Require drug testing for students participating in athletics or other extracurricular activities p. Require students to wear uniforms q. Enforce a strict dress coder. Require clear book bags or ban book bags on school grounds s. Provide a structured anonymous threat reporting system (e.g., online submission, telephone hotline, or written submission via drop box) t. Require students to wear badges or picture u. Prohibit non-academic use of cell phones or smartphones during",4787
4789,"Does your school have a written plan that describes procedures to be performed in the following scenarios? a. Active shooter* b. Natural disasters (e.g., earthquakes or tornadoes) c. Hostages d. Bomb threats or incidents e. Chemical, biological, or radiological threats or incidents (e.g., release 1 2 of mustard gas, anthrax, smallpox, or radioactive materials) f. Suicide threats or incidents g. Pandemic disease 161 h. Post-crisis reunification of students with their families",4788
4790,"During the 2019–20 school year, has your school drilled students on the use of the following emergency procedures? a. Evacuation* b. Lockdown* c. Shelter-in-place*",4789
4791,"During the 2019–20 school year, did your school have any activities that included the following components for students? a. Prevention curriculum, instruction, or training for students (e.g., conflict resolution, anti-bullying*, dating violence* prevention) b. Social and emotional learning (SEL) for students (e.g., social skills, anger management, mindfulness) c. Behavioral or behavior modification intervention for students (including the use of positive reinforcements) d. Individual mentoring, tutoring, or coaching of students by adults e. Student involvement in peer mediation f. Student court to address student conduct problems or minor offenses g. Student involvement in restorative practices* (e.g., peace or conflict circles) h. Programs to promote a sense of community or social integration among students",4790
4792,"During the 2019–20 school year, did your school have a threat assessment* team or any other formal group of persons to identify students who might be a potential risk for violent or harmful behavior (toward themselves or others)?",4791
4793,"During the 2019–20 school year, did your school have any recognized student groups with the following purposes? a. Acceptance of sexual orientation* and gender identity* of students (e.g., 1 Gay-Straight Alliance) b. Acceptance of students with disabilities (e.g., Best Buddies) c. Acceptance of cultural or religious diversity (e.g., Cultural Awareness Club",4792
4794,Which of the following does your school do to involve or help parents? a. Have a formal process to obtain parental input on policies related to school crime and discipline b. Provide training or technical assistance to parents in dealing with students' problem behavior,4793
4795,"During the 2019–20 school year, were any of the following community and outside groups involved in your school’s efforts to promote a safe school? a. Parent groups b. Social service agencies c. Juvenile justice agencies d. Law enforcement agencies e. Mental health agencies f. Civic organizations or service clubs g. Private corporations or businesses h. Religious organization",4794
4796,"During the 2019–20 school year, did you have any sworn law enforcement officers (including School Resource Officers*) present at your school* at least once a week?",4795
4797,"Were sworn law enforcement officers (including School Resource Officers*) used at least once a week in or around your school at the following times? a. While students were arriving or leaving b. At selected school activities (e.g., athletic and social events, open houses) c. When school or school activities were not occur",4796
4798,"Did any of the sworn law enforcement officers (including School Resource Officers*) at your school* routinely: a. Carry physical restraints (e.g., handcuffs, Tasers) b. Carry chemical aerosol sprays (e.g., Mace, pepper spray) c. Carry a firearm* d. Wear a body camera",4797
4799,"Did these sworn law enforcement officers (including School Resource Officers*) participate in the following activities at your school*? a. Motor vehicle traffic control b. Security enforcement and patrol c. Maintaining student discipline d. Identifying problems in the school and proactively seeking solutions to those problems e. Training teachers and staff in school safety or crime prevention f. Mentoring students g. Teaching a law-related education course or training students (e.g., drug-related education, criminal law, or crime prevention courses) h. Recording or reporting discipline problems to school authorities i. Providing information to school authorities about the legal definitions of behavior for recording or reporting purposes (e.g., defining assault for school authorities)",4798
4800,"During the 2019–20 school year, did your school or school district have any formalized policies or written documents (e.g., Memorandum of Understanding, Memorandum of Agreement) that outlined the roles, responsibilities, and expectations of sworn law enforcement officers (including School Resource Officers*) at school*?",4799
4801,"Did these formalized policies or written documents include language defining the role of sworn law enforcement officers (including School Resource Officers*) at school* in the following areas? a. Student discipline b. Use of physical restraints (e.g., handcuffs, Tasers) or chemical aerosol sprays (e.g., Mace, pepper spray) c. Use of firearms* d. Making arrests* on school grounds e. Reporting of criminal offenses to a law enforcement agency",4800
4802,"How many of the following were present at your school* at least once a week? • If an officer works full-time across various schools in the district, please count this officer as ""Part-time"" for your school. • If none, please place an ""X"" in the None box. Number at your school* a. School Resource Officers* i. Full-time 0 236 0 ii. Part-time b. Sworn law enforcement officers who are not School Resource Officers* i. Full-time ii. Part-time ",4801
4803,"Aside from sworn law enforcement officers (including School Resource Officers*), how many additional security officers or security personnel were present at your school* at least once a week? • If a security officer or other security personnel works full-time across various schools in the district, please count this person as “Part-time” for your school. Number at your school* Security officers or security personnel None a. Full-time b. Part-time",4802
4804,"During the 2019–20 school year, did your school provide diagnostic mental health assessments* (e.g., psychological/psychiatric diagnostics assessments) to evaluate students for mental health disorders*?",4803
4805,"Were diagnostic mental health assessment* services provided to students from your school in the following locations? a. At school*, by a school-employed or contracted mental health professional* b. Outside of school, by a school-employed or contracted mental health professional*",4804
4806,"During the 2019–20 school year, did your school provide treatment* (e.g., psychotherapy, medication) to students for mental health disorders*? • Include only treatment* provided by a licensed mental health professional*. • Include services that were provided at school* as well as services provided through a contract the school has with an outside provider.",4805
4807,"Were treatment* services provided to students from your school in the following locations? a. At school*, by a school-employed or contracted mental health professional* b. Outside of school, by a school-employed or contracted mental health professional*",4806
4808,"During the 2019–20 school year, to what extent did the following factors limit your school’s efforts to provide mental health services to students? • Check one response on each line. Limits in Limits in Does not major way minor way limit a. Inadequate access to licensed mental health professionals* b. Inadequate funding c. Potential legal issues for school or district (e.g., malpractice, insufficient supervision, confidentiality) 678 d. Concerns about reactions from parents e. Lack of community support for providing mental health services to students in your school f. Written or unwritten policies regarding the school’s requirement to pay for the diagnostic mental health assessment* or treatment* of students g. Reluctance to label students with mental health disorders* to avoid stigmatizing the child",4807
4809,"During the 2019–20 school year, did your school or school district provide any of the following for classroom teachers or aides? YES NO a. Training in classroom management for teachers b. Training in school-wide discipline policies and practices related to violence* c. Training in school-wide discipline policies and practices related to cyberbullying* d. Training in school-wide discipline policies and practices related to bullying* other than cyberbullying* e. Training in school-wide discipline policies and practices related to alcohol and/or drug use f. Training in safety procedures (e.g., how to handle emergencies) g. Training in recognizing early warning signs of students likely to exhibit violent behavior h. Training in recognizing signs of self-harm or suicidal tendencies i. Training in intervention and referral strategies for students displaying signs of mental health disorders* (e.g., depression, mood disorders, ADHD) j. Training in recognizing physical, social, and verbal bullying* behaviors k. Training in recognizing signs of students using/abusing alcohol and/or drugs l. Training in positive behavioral intervention strategies m. Training in crisis prevention and intervention",4808
4810,"Aside from sworn law enforcement officers (including School Resource Officers*) or other security officers or personnel who carry firearms, during the 2019–20 school year, were there any staff at your school* who legally carried a firearm* on school property?",4809
4811,To what extent do the following factors limit your school’s efforts to reduce or prevent crime? • Check one response on each line. Limits in Limits in Does not major way minor way limit a. Lack of or inadequate teacher training in classroom management b. Lack of or inadequate alternative placement or programs for disruptive students c. Likelihood of complaints from parents d. Lack of teacher support for school policies e. Lack of parental support for school policies f. Teachers’ fear of student retaliation g. Fear of litigation h. Inadequate funds i. Inconsistent application of school policies by faculty or staff,4810
